{
  "name": "Bloom Blocked (perfopt)",
  "iterations": 5,
  "preprocess": "preprocess_s_and_n_elements_log",
  "fixture": "MTCount",
  "generator": "RandomHuge2",
  "visualization": {
    "enable": false
  },
  "parameter": {
    "k": [ 1, 2, 3, 4, 5, 6, 7, 8, 9, 10, 11, 12, 13, 14, 15, 16, 17, 18, 19, 20, 21, 22, 23, 24, 25 ],
    "s": [
      400,
      2600,
      100,
      100,
      2600
    ],
    "n_partitions": [ 32, 64, 128, 256, 512, 1024, 2048, 4096 ],
    "n_threads": [
      10
    ],
    "n_elements": [
      {
        "build": 10,
        "lookup": 10,
        "shared": 10
      },
      {
        "build": 4,
        "lookup": 8,
        "shared": 10
      },
      {
        "build": 8,
        "lookup": 8,
        "shared": 10
      },
      {
        "build": 25,
        "lookup": 0,
        "shared": 10
      },
      {
        "build": 1000,
        "lookup": 100000000,
        "shared": 10
      }
    ]
  },
  "optimization": {
    "Addressing": "Lemire",
    "Hashing": "Murmur",
    "Partitioning": null,
    "RegisterSize": "_64bit",
    "SIMD": "AVX512",
    "EarlyStopping": "Disabled",
    "MultiThreading": "Disabled"
  },
  "benchmarks": [
    {
      "name": "Bloom_Blocked64_Nonpart_AVX512",
      "filter": {
        "type": "Bloom",
        "variant": "Blocked64"
      },
      "optimization": {
        "Partitioning": "Disabled"
      },
      "parameter": {
        "n_partitions": [ 1 ]
      }
    },
    {
      "name": "Bloom_Blocked64_Part_AVX512",
      "filter": {
        "type": "Bloom",
        "variant": "Blocked64"
      },
      "optimization": {
        "Partitioning": "Enabled"
      }
    },
    {
      "name": "Bloom_Blocked512_Nonpart_AVX512",
      "filter": {
        "type": "Bloom",
        "variant": "Blocked512"
      },
      "optimization": {
        "Partitioning": "Disabled"
      },
      "parameter": {
        "n_partitions": [ 1 ]
      }
    },
    {
      "name": "Bloom_Blocked512_Part_AVX512",
      "filter": {
        "type": "Bloom",
        "variant": "Blocked512"
      },
      "optimization": {
        "Partitioning": "Enabled"
      }
    }
  ]
}
