{
  "name": "Xor Count 10K",
  "iterations": 5,
  "preprocess": "preprocess_s",
  "fixture": "MTCount",
  "generator": "Random",
  "visualization": {
    "enable": false
  },
  "parameter": {
    "k": [
      1,
      2,
      3,
      4,
      5,
      6,
      7,
      8,
      9,
      10,
      11,
      12,
      13,
      14,
      15,
      16,
      17,
      18,
      19,
      20,
      21,
      22,
      23,
      24,
      25
    ],
    "s": [
      400,
      2600,
      100,
      120,
      2600
    ],
    "n_partitions": [
      1
    ],
    "n_threads": [
      10
    ],
    "n_elements": [
      {
        "build": 10000,
        "lookup": 100000000,
        "shared": 10
      }
    ]
  },
  "optimization": {
    "Addressing": "Lemire",
    "Hashing": "Murmur",
    "Partitioning": null,
    "RegisterSize": "_64bit",
    "SIMD": null,
    "EarlyStopping": "Disabled",
    "MultiThreading": "Disabled"
  },
  "benchmarks": [
    {
      "name": "Xor_Nonpart_Scalar",
      "filter": {
        "type": "Xor",
        "variant": "Standard"
      },
      "optimization": {
        "Partitioning": "Disabled",
        "SIMD": "Scalar"
      }
    },
    {
      "name": "Xor_Nonpart_AVX512",
      "filter": {
        "type": "Xor",
        "variant": "Standard"
      },
      "optimization": {
        "Partitioning": "Disabled",
        "SIMD": "AVX512"
      }
    }
  ]
}
