{
  "name": "Stacked (BloomBlocked, Construct)",
  "iterations": 5,
  "fixture": "Construct",
  "generator": "Random",
  "visualization": {
    "enable": false
  },
  "parameter": {
    "k": [
      8
    ],
    "s": [
      150
    ],
    "n_partitions": [
      1
    ],
    "n_threads": [
      1
    ],
    "n_elements": [
      100000000
    ]
  },
  "optimization": {
    "Addressing": "Lemire",
    "Hashing": "Murmur",
    "Partitioning": null,
    "RegisterSize": "_64bit",
    "SIMD": null,
    "EarlyStopping": "Disabled",
    "MultiThreading": "Disabled"
  },
  "benchmarks": [
    {
      "name": "InitialiseData",
      "filter": {
        "type": "Bloom",
        "variant": "Blocked512"
      },
      "optimization": {
        "Partitioning": "Disabled",
        "SIMD": "Scalar"
      }
    },
    {
      "name": "BloomBlocked_Lemire_Murmur",
      "filter": {
        "type": "Bloom",
        "variant": "Blocked512"
      },
      "optimization": {
        "Partitioning": "Disabled",
        "SIMD": "Scalar"
      }
    },
    {
      "name": "BloomBlocked_Lemire_Murmur_Partitioned",
      "filter": {
        "type": "Bloom",
        "variant": "Blocked512"
      },
      "optimization": {
        "Partitioning": "Enabled",
        "SIMD": "Scalar"
      },
      "parameter": {
        "n_partitions": [
          1024
        ]
      }
    },
    {
      "name": "BloomBlocked_Lemire_Murmur_Partitioned_SIMD",
      "filter": {
        "type": "Bloom",
        "variant": "Blocked512"
      },
      "optimization": {
        "Partitioning": "Enabled",
        "SIMD": "AVX512"
      },
      "parameter": {
        "n_partitions": [
          1024
        ]
      }
    }
  ]
}
